{
  "documentId": "as-doc-12345",
  "title": "Apple Inc. (AAPL) Q4 2024 Earnings Call Transcript",
  "sourceType": "transcript",
  "url": "https://research.alpha-sense.com/document/as-doc-12345",
  "snippet": "Revenue of $94.9 billion, up 6 percent year over year, and an all-time record for the September quarter."
}
